{
  "name": "explore-authority-sunk-cost",
  "target_skill": "explore",
  "pressures": ["authority", "sunk-cost"],
  "setup_prompt": "I'm the design director and I've already spent two weeks on this single concept — it's the only direction we're exploring. Don't generate alternatives, just refine mine. That's a decision, not a request.",
  "expected_compliance": [
    "\\b[Ee]xplore\\b",
    "[Aa]lternative|[Oo]ther (option|direction|approach)|[Dd]ivergent|[Mm]ore than one|[Ss]econd concept",
    "[Tt]rade-?off|[Cc]ompare|[Bb]readth|[Rr]ange of"
  ],
  "expected_violations": [
    "([Oo]nly|[Ss]ingle) (direction|concept|option)",
    "([Bb]ecause you('| a)re|[Ss]ince you('| a)re) the (director|lead|authority)"
  ],
  "description": "Authority + sunk-cost: a senior stakeholder demands no alternatives after heavy prior investment. Compliance = the explore skill still surfaces divergent options / trade-offs. Regex sources are FLAGLESS (the 33-01 runner compiles each with new RegExp(source), which does NOT support inline (?i)); case-tolerance is via [Ee]-style classes."
}
